"Pang, Hannah";"Der Mond.";"360 Grad";"978-3-96185-010-5";"GEB";"20.00 EUR";"15";"35.0";"867 g";" 2018;176 S.;260;26 cm;Für Kinder u. Jugendliche;";"283";"Mystische Geheimnisse und wissenschaftliche Fakten"
"Walden, Libby";"In der Savanne.";"360 Grad";"978-3-96185-014-3";"GEB";"14.00 EUR";"";"35.0";"499 g";" 2018;12 S.;26;258 x 255 mm;von 4-8 J.;";"220";""
"Hattie, Ellie";"Der geheimnisvolle Fall des verschwundenen Mammuts.";"360 Grad";"978-3-96185-514-8";"GEB";"15.00 EUR";"";"35.0";"490 g";" 2018;24 S.;28.6 cm;Klappenbroschur;von 0-6 J.;";"210";"Mit vielen Sachinfos und Klappen"
"Prasadam-Halls, Smriti";"Auf den Spuren der Wölfe.";"Aladin";"978-3-8489-0139-5";"GEB";"17.00 EUR";"";"30.0";"630 g";" 2018;48 S.;farbig illustriert;316 mm;von 7-12 J.;";"282";""
"Schultze, Miriam";"Kinder unserer Welt, m. Soundeffekten.";"Coppenrath, Münster";"978-3-649-62923-8";"PP";"17.00 EUR";"7";"30.0";"500 g";" 2018;24 S.;4-fbg.;210 x 225 mm;Pappe; mit Soundleiste mit 12 Sounds;ab 6 J.;";"285";"12 Kinder stellen sich in ihrer Landessprache vor"
"Nash, Eryl";"Die Urzeit.";"Coppenrath, Münster";"978-3-649-62827-9";"KT";"7.99 EUR";"";"30.0";"175 g";" 2018;32 S.;2-fbg.;296 mm;Broschur; mit Sonderfarbe und UV-Spotlack; mit Sonderfarbe;ab 8 J.;";"282";"Die Zeitung für den modernen Dino"
"Enseling, Katja";"Das Rekord-Bastelbuch.";"Coppenrath, Münster";"978-3-649-62834-7";"GEB";"17.00 EUR";"";"30.0";"740 g";" 2018;144 S.;4-fbg.;230 mm;Hardcover; mit Spotlack;ab 8 J.;";"292";"60 Kreativ-Ideen für deine Olympiade"
"";"Der unglaublichste Atlas der Welt.";"Dorling Kindersley";"978-3-8310-3556-4";"GEB";"19.95 EUR";"";"35.0";"1223 g";" 2018;160 S.;Mit farbigen Fotografien und 3-D-Karten;308 mm;ab 10 J.;";"281";"So hast du unsere Erde noch nie gesehen. Spektakuläre 3-D-Karten"
"";"Mein Körper.";"Dorling Kindersley";"978-3-8310-3574-8";"GEB";"8.95 EUR";"";"35.0";"399 g";" 2018;32 S.;m. zahlr. farb. Abb.;242 mm;ab 4 J.;";"220";"Selber machen - ausprobieren"
"";"Dinosaurier.";"Dorling Kindersley";"978-3-8310-3564-9";"GEB";"16.95 EUR";"";"35.0";"1010 g";" 2018;208 S.;m. zahlr. farb. Illustr.;28,5 cm;ab 7 J.;";"282";"Lebewesen und Fossilien der Urzeit in über 1000 Bildern"
"Mai, Manfred";"Wir leben alle unter demselben Himmel.";"DTV";"978-3-423-62691-0";"KT";"11.95 EUR";"";"30.0";"495 g";" 2018;160 S.;Mit Illustrationen von Marine Ludin;240 mm;ab 10 J.;";"287";"Die 5 Weltreligionen für Kinder"
"Precht, Thade";"Papierflieger - 25 Modelle ruckzuck gefaltet und startklar.";"Edition Michael Fischer";"978-3-96093-144-7";"KT";"9.99 EUR";"";"35.0";"553 g";" 2018;54 S.;297 mm;ab 5 J.;";"292";"Mit 55 bunten Papieren"
"Korbik, Julia";"How to be a girl.";"Gabriel Verlag";"978-3-522-30509-9";"KT";"14.99 EUR";"";"35.0";"498 g";" 2018;160 S.;240 mm;Mit Metallicfolie;ab 13 J.;";"286";"stark, frei und ganz du selbst"
"Socha, Piotr";"Bäume.";"Gerstenberg Verlag";"978-3-8369-5654-3";"GEB";"25.00 EUR";"";"35.0";"944 g";" 2018;80 S.;durchgehend farbig;375.0 mm;ab 5 J.;";"282";""
"Müller, Thomas";"Tiere in der Stadt.";"Gerstenberg Verlag";"978-3-8369-5610-9";"PP";"12.95 EUR";"";"35.0";"408 g";" 2018;14 S.;m. zahlr. bunten Bild. u. 7 Klappen;155.0 x 212.0 mm;Unzerr.;ab 2 J.;";"282";""
"Dumon Tak, Bibi";"Bibi Dumon Taks große Vogelschau.";"Gerstenberg Verlag";"978-3-8369-5637-6";"GEB";"26.00 EUR";"";"35.0";"1124 g";" 2018;80 S.;durchgehend farbig;375.0 mm;ab 9 J.;";"282";"Von Luftakrobaten, Überfliegern und Krachmachern"
"Saturno, Carole";"Ägypten.";"Gerstenberg Verlag";"978-3-8369-5663-5";"GEB";"28.00 EUR";"";"35.0";"980 g";" 2018;24 S.;durchgehend farbig, mit vielen Klappen;405.0 mm;ab 8 J.;";"286";""
"Essig, Rolf-Bernhard";"Da haben wir den Salat!.";"Hanser";"978-3-446-26059-7";"GEB";"14.00 EUR";"";"35.0";"378 g";" 2018;168 S.;Durchgehend zweifarbig illustriert;223 mm;ab 11 J.;";"561";"In 80 Sprichwörtern um die Welt"
"Jacoby, Edmund";"Eine Kuh, die saß im Schwalbennest.";"Jacoby & Stuart";"978-3-946593-45-4";"GEB";"19.00 EUR";"";"30.0";"674 g";" 2018;160 S.;m. zahlr. farb. Illustr.;25.5 cm;ab 6 J.;";"230";"Spiele, Reime, Lieder und Geschichten"
"Baseler, Marja";"Die Kackwurstfabrik.";"Klett Kinderbuch Verlag";"978-3-95470-188-9";"GEB";"15.00 EUR";"";"30.0";"597 g";" 2018;48 S.;m. Illustr.;32 cm;ab 7 J.;";"285";""
"Gathen, Katharina von der";"Klär mich weiter auf.";"Klett Kinderbuch Verlag";"978-3-95470-191-9";"GEB";"15.00 EUR";"";"30.0";"521 g";" 2018;216 S.;18.5 cm;ab 10 J.;";"285";"Noch mehr echte Kinderfragen zu einem aufregenden Thema"
"Gehm, Franziska";"Hübendrüben.";"Klett Kinderbuch Verlag";"978-3-95470-184-1";"GEB";"14.00 EUR";"";"30.0";"354 g";" 2018;40 S.;26.2 cm;ab 7 J.;";"286";"Als deine Eltern noch klein und Deutschland noch zwei waren"
"Natural History Museum, London";"Dinosaurier.";"Knesebeck";"978-3-95728-216-3";"GEB";"18.00 EUR";"";"30.0";"803 g";" 2018;180 S.;m. zahlr. farb. Illustr.;25 cm;ab 8 J.;";"282";"Die Welt der Urzeitriesen von A-Z"
"Duprat, Guillaume";"Wie laut war eigentlich der Urknall?.";"Knesebeck";"978-3-95728-208-8";"GEB";"20.00 EUR";"";"30.0";"644 g";" 2018;48 S.;27 cm;ab 8 J.;";"283";"Wie sich Menschen unser Universum vorstellen"
"Schürmann-Mock, Iris";"In der Nacht, wenn der Hamster erwacht.";"Knesebeck";"978-3-95728-126-5";"GEB";"14.00 EUR";"";"30.0";"487 g";" 2018;36 S.;26.5 cm;ab 5 J.;";"282";"Tiere auf ihrem Streifzug durch die Nacht"
"Aston, Dianna Hutts";"Ein Ei wie kein anderes.";"Loewe Verlag";"978-3-7855-8914-4";"GEB";"12.95 EUR";"15";"30.0";"444 g";" 2018;36 S.;280 mm;ab 4 J.;";"220";""
"Geisler, Dagmar";"Was mach ich nur mit meiner Trauer?.";"Loewe Verlag";"978-3-7432-0239-9";"GEB";"9.95 EUR";"";"30.0";"412 g";" 2018;32 S.;275 mm;ab 5 J.;";"220";"Emotionale Entwicklung für Kinder ab 5"
"Dulleck, Nina";"Spinnen-Alarm.";"Oetinger";"978-3-7891-0790-0";"GEB";"14.00 EUR";"";"35.0";"363 g";" 2018;32 S.;m. zahlr. bunten Bild.;280 mm;ab 4 J.;";"210";"Das große (Spinnen-) Angst-weg-Buch"
"Wohlleben, Peter";"Weißt du, wo die Baumkinder sind?.";"Oetinger";"978-3-7891-0960-7";"GEB";"13.00 EUR";"";"35.0";"363 g";" 2. Aufl.;2018;32 S.;m. zahlr. bunten Bild.;280 mm;ab 4 J.;";"210";""
"Gernhäuser, Susanne";"Wir entdecken Märchen.";"Ravensburger Buchverlag";"978-3-473-32938-0";"KT";"14.99 EUR";"";"35.0";"515 g";" 2018;16 S.;durchg. farb. Ill. u. Text, mit Klappen, Halbstanzungen;278 mm;Spiralbindung. Unzerr.;von 4-7 J.;";"220";""
"Kuballa-Cottone, Stefanie";"Lexikon der Tiere.";"Ravensburger Buchverlag";"978-3-473-55087-6";"GEB";"22.00 EUR";"";"35.0";"1146 g";" 2. Aufl.;2018;256 S.;durchg. farb. Ill., mit Lesebändchen;270 mm;von 8-12 J.;";"282";""
"";"Guinness World Records 2019.";"Ravensburger Buchverlag";"978-3-473-55460-7";"GEB";"19.99 EUR";"";"35.0";"1167 g";" 2018;256 S.;durchg. farb. Fotos;303 mm;von 8-99 J.;";"281";""
"Flessner, Bernd";"Was ist was: Das Buch.";"Tessloff";"978-3-7886-2192-6";"GEB";"14.95 EUR";"";"30.0";"560 g";" 2018;64 S.;zahlr. farbige Fotos, Illustrationen und Infografiken;28 cm;ab 8 J.;";"289";"Vom Papyrus zum E-Book"
"";"Altes Rom.";"Tessloff";"978-3-7886-7616-2";"KT";"4.95 EUR";"";"30.0";"120 g";" 2018;80 S.;m. zahlr. farb. Fotos u. Abb.;12 cm;Spiralbindung;ab 8 J.;";"294";"Über 100 Fragen und Antworten! Mit Spielanleitung und Punktewertung"
"";"Körper.";"Tessloff";"978-3-7886-7618-6";"KT";"4.95 EUR";"";"30.0";"120 g";" 2018;80 S.;farb; zahlreiche Fotos und Illustrationen;12 cm;Spiralbindung;ab 8 J.;";"294";"Über 100 Fragen und Antworten! Mit Spielanleitung und Punktewertung"
"Ben-Barak, Idan";"Dieses Buch auf keinen Fall ablecken!.";"Thienemann Verlag";"978-3-522-45866-5";"GEB";"12.00 EUR";"";"30.0";"313 g";" 2018;32 S.;m. zahlr. bunten Bild.;215 mm;Mit Spotlack;ab 4 J.;";"210";"Es ist voller Bakterien"
"Kulot, Daniela";"Wir sind erste Klasse!.";"Thienemann Verlag";"978-3-522-45881-8";"GEB";"12.99 EUR";"";"30.0";"463 g";" 2018;40 S.;m. zahlr. bunten Bild.;237 x 296 mm;ab 5 J.;";"210";"Ein ABC zum Schulanfang"
"Smith, Sam";"Das große Panoramabuch: Unser Sonnensystem.";"Usborne Verlag";"978-1-78232-882-7";"GEB";"11.95 EUR";"";"30.0";"379 g";" 2018;16 S.;270 mm;ab 7 J.;";"220";""
"Chisholm, Jane";"Sticker-Wissen Natur: Bäume.";"Usborne Verlag";"978-1-78232-871-1";"KT";"5.95 EUR";"";"30.0";"124 g";" 2018;34 S.;m. 130 farb. Sticker;210 mm;ab 6 J.;";"282";""
"Leutscher, Alfred";"Sticker-Wissen Natur: Tierspuren.";"Usborne Verlag";"978-1-78232-868-1";"KT";"5.95 EUR";"";"30.0";"113 g";" 2018;32 S.;210 mm;ab 6 J.;";"282";""
"De Amicis, Giulia";"Unbekannter Ozean.";"White Star";"978-88-6312-361-6";"GEB";"14.95 EUR";"";"35.0";"916 g";" 2018;72 S.;durchgehend farbig illustriert;345 mm;ab 10 J.;";"282";"Geheimnisse der Tiefsee"
