"Mai, Manfred";"Philipp darf nicht petzen.";"Arena";"978-3-401-51036-1";"KT";"6.00 EUR";"";"30.0";"126 g";" 2017;56 S.;m. Illustr.;19,5 cm;ab 6 J.;";"240";""
"Dilg, Sonja";"Mein superstarker Grundschulblock. Fit für die 1. Klasse.";"Arena";"978-3-401-71136-2";"KT";"5.00 EUR";"";"30.0";"465 g";" 2017;192 S.;207 mm;Geblockt;ab 6 J.;";"291";""
"Fährmann, Willi";"Die schönsten Fußballgeschichten für Erstleser. Von Toren, Stürmern und echten Helden.";"Arena";"978-3-401-70950-5";"GEB";"6.99 EUR";"";"30.0";"490 g";" 2017;176 S.;212.00 mm;ab 6 J.;";"240";""
"Kalwitzki, Sabine";"Das Geheimnis des Mammut-Amuletts.";"Arena";"978-3-401-70947-5";"GEB";"7.99 EUR";"";"30.0";"281 g";" 2017;56 S.;Beil. Abc-Stickerbogen und Wackelbild-Lesezeichen;211 mm;ab 6 J.;";"240";"Eine Detektivgeschichte zum Mitraten"
"Kalwitzki, Sabine";"Das Geheimnis des Mammut-Amuletts.";"Arena";"978-3-401-70947-5";"GEB";"7.99 EUR";"";"30.0";"281 g";" 2017;56 S.;Beil. Abc-Stickerbogen und Wackelbild-Lesezeichen;211 mm;ab 6 J.;";"240";"Eine Detektivgeschichte zum Mitraten"
"Röhrig, Volkmar";"Spannende Ponygeschichten.";"Arena";"978-3-401-70906-2";"GEB";"7.99 EUR";"";"30.0";"258 g";" 2017;48 S.;212.00 mm;Mit Bücherbärfigur am Lesebändchen, Abc-Stickerbogen und Wackelbild-Lesezeichen;ab 6 J.;";"240";""
"Seltmann, Christian";"Paul. Plötzlich Vampir! Ein Schultag mit Biss.";"Arena";"978-3-401-70566-8";"GEB";"7.99 EUR";"";"30.0";"336 g";" 2017;48 S.;26 cm;Mit Bücherbärfigur am Lesebändchen, Abc-Stickerbogen und Wackelbild-Lesezeichen;ab 6 J.;";"240";"Mit Silbentrennung zum leichteren Lesenlernen"
"Grimm, Sandra";"Greta Glückspilz. Eine Schultasche voller Glück.";"Arena";"978-3-401-71102-7";"GEB";"7.99 EUR";"";"30.0";"330 g";" 2017;48 S.;m. Illustr.;280.00 mm;Mit Bücherbärfigur am Lesebändchen, Abc-Stickerbogen und Wackelbild-Lesezeichen;ab 5 J.;";"240";"Lustige Schulgeschichten"
"Baumbach, Martina";"Weihnachten im Holunderweg.";"Carlsen";"978-3-551-31608-0";"KT";"5.99 EUR";"";"35.0";"132 g";" 2017;128 S.;m. Illustr.;19 cm;von 6-8 J.;";"230";"24 Geschichten bis zum Weihnachtsfest"
"Andersen, Hans Christian";"Andersen - Die illustrierten Märchen.";"Die Gestalten Verlag";"978-3-89955-790-9";"GEB";"19.90 EUR";"15";"33.0";"914 g";" 2017;176 S.;24 cm;Grundschulalter;";"260";""
"Baltscheit, Martin";"Besuch Aus Tralien.";"Dressler Verlag GmbH";"978-3-7915-0045-4";"GEB";"12.99 EUR";"";"35.0";"502 g";" 2017;128 S.;232 mm;ab 6 J.;";"250";""
"Neuschaefer, Katharina";"König Artus und die Ritter der Tafelrunde.";"Ellermann";"978-3-7707-3335-4";"GEB";"16.99 EUR";"";"35.0";"652 g";" 2017;128 S.;m. Illustr.;240 mm;ab 5 J.;";"260";"Neu erzählt"
"Rohner, Viola";"Immer wieder Minna.";"Peter Hammer Verlag";"978-3-7795-0581-5";"GEB";"12.90 EUR";"";"30.0";"322 g";" 2017;64 S.;24 cm;ab 5 J.;";"240";""
"Vogel, Maja von";"Der kleine Drache rettet einen Freund.";"Loewe Verlag";"978-3-7855-8571-9";"GEB";"7.95 EUR";"";"30.0";"350 g";" 2017;48 S.;245 mm;ab 5 J.;";"240";"Mit tollen Stickern zum Sammeln!"
"Richert, Katja";"Leselöwen 1. Klasse - Zwei Freundinnen und ein verliebter Hund.";"Loewe Verlag";"978-3-7855-8601-3";"GEB";"7.95 EUR";"11";"30.0";"342 g";" 2017;48 S.;m. zahlr. farb. Illustr.;245 mm;ab 6 J.;";"240";""
"Benn, Amelie";"Delfingeschichten.";"Loewe Verlag";"978-3-7855-8574-0";"GEB";"7.95 EUR";"15";"30.0";"352 g";" 2017;48 S.;m. Stickerbogen;24,5 cm;ab 5 J.;";"240";""
"Reider, Katja";"Schulklassengeschichten.";"Loewe Verlag";"978-3-7855-8603-7";"GEB";"7.95 EUR";"";"30.0";"372 g";" 2017;64 S.;m. zahlr. farb. Illustr.;245 mm;ab 7 J.;";"240";"Leselöwen 2. Klasse"
"Bendixen, Katharina";"Zorro, der Mops - Der Held vom Sommersee.";"Loewe Verlag";"978-3-7855-8423-1";"GEB";"12.95 EUR";"";"30.0";"604 g";" 2017;128 S.;245 mm;ab 6 J.;";"240";""
"Maar, Paul";"Das große Buch von Paul Maar.";"Oetinger";"978-3-7891-0824-2";"GEB";"19.99 EUR";"";"35.0";"1172 g";" 2017;256 S.;m. Illustr.;280 mm;ab 6 J.;";"250";""
"Maar, Paul";"Das große Buch von Paul Maar.";"Oetinger";"978-3-7891-0824-2";"GEB";"19.99 EUR";"";"35.0";"1172 g";" 2017;256 S.;m. Illustr.;280 mm;ab 6 J.;";"250";""
"McLay, John";"Jakob will Ritter werden.";"Ravensburger Buchverlag";"978-3-473-36516-6";"GEB";"7.99 EUR";"";"35.0";"311 g";" 2017;64 S.;durchg. farb. Ill.;240 mm;ab 6 J.;";"240";"Mit Stickern"
"Tino";"Wikingergeschichten.";"Ravensburger Buchverlag";"978-3-473-36518-0";"GEB";"7.99 EUR";"";"35.0";"205 g";" 2017;48 S.;m. zahlr. farb. Illustr.;215 mm;ab 7 J.;";"240";""
"Klein, Martin";"Finn und Frieda halten den Herbst auf.";"Tulipan";"978-3-86429-395-5";"GEB";"8.95 EUR";"";"30.0";"214 g";" 2017;48 S.;m. zahlr. farb. Illustr.;21 cm;ab 7 J.;";"240";"Lesestufe B"
